{
  "bomFormat": "CycloneDX",
  "specVersion": "1.5",
  "version": 1,
  "metadata": {
    "tools": [
      {
        "vendor": "dev-skills-suite",
        "name": "sbom-generator",
        "version": "0.1.0"
      }
    ],
    "component": {
      "type": "application",
      "name": "sample-project",
      "version": "2.3.0"
    }
  },
  "components": [
    {
      "type": "library",
      "name": "serde",
      "version": "1.0.200",
      "purl": "pkg:cargo/serde@1.0.200",
      "properties": [
        {
          "name": "sds:ecosystem",
          "value": "crates.io"
        }
      ]
    },
    {
      "type": "library",
      "name": "left-pad",
      "version": "1.3.0",
      "purl": "pkg:npm/left-pad@1.3.0",
      "properties": [
        {
          "name": "sds:ecosystem",
          "value": "npm"
        }
      ],
      "licenses": [
        {
          "expression": "WTFPL"
        }
      ]
    },
    {
      "type": "library",
      "name": "lodash",
      "version": "4.17.21",
      "purl": "pkg:npm/lodash@4.17.21",
      "properties": [
        {
          "name": "sds:ecosystem",
          "value": "npm"
        }
      ],
      "licenses": [
        {
          "expression": "MIT"
        }
      ]
    },
    {
      "type": "library",
      "name": "requests",
      "version": "2.32.3",
      "purl": "pkg:pypi/requests@2.32.3",
      "properties": [
        {
          "name": "sds:ecosystem",
          "value": "PyPI"
        }
      ]
    }
  ]
}
