{
  "bomFormat": "CycloneDX",
  "specVersion": "1.5",
  "version": 1,
  "components": [
    { "type": "library", "name": "lodash", "version": "4.17.21", "purl": "pkg:npm/lodash@4.17.21", "licenses": [{ "expression": "MIT" }] },
    { "type": "library", "name": "left-pad", "version": "1.3.0", "purl": "pkg:npm/left-pad@1.3.0", "licenses": [{ "expression": "WTFPL" }] },
    { "type": "library", "name": "readline-gpl", "version": "8.2.0", "purl": "pkg:generic/readline-gpl@8.2.0", "licenses": [{ "expression": "GPL-3.0-only" }] },
    { "type": "library", "name": "libfoo", "version": "2.0.1", "purl": "pkg:generic/libfoo@2.0.1", "licenses": [{ "license": { "id": "LGPL-2.1-or-later" } }] },
    { "type": "library", "name": "mystery-lib", "version": "0.9.0", "purl": "pkg:npm/mystery-lib@0.9.0" },
    { "type": "library", "name": "dual-licensed", "version": "3.1.0", "purl": "pkg:cargo/dual-licensed@3.1.0", "licenses": [{ "expression": "MIT OR Apache-2.0" }] },
    { "type": "library", "name": "old-id-lib", "version": "1.0.0", "purl": "pkg:npm/old-id-lib@1.0.0", "licenses": [{ "expression": "GPL-2.0" }] },
    { "type": "library", "name": "agpl-service", "version": "5.0.0", "purl": "pkg:generic/agpl-service@5.0.0", "licenses": [{ "expression": "AGPL-3.0-only" }] }
  ]
}
